Name	Website	IP	Latitude	Longitude
Princeton University Princeton, NJ	www.princeton.edu	128.112.132.86	40.376	-74.66
Harvard University Cambridge, MA	www.harvard.edu	54.230.48.192	47.584	-122.3
Yale University New Haven, CT	www.yale.edu	130.132.35.53	41.308	-72.928
Columbia University New York, NY	www.columbia.edu	128.59.105.24	40.801	-73.965
Stanford University Stanford, CA	www.stanford.edu	54.200.81.11	45.779	-119.529
University of Chicago Chicago, IL	www.uchicago.edu	198.101.129.15	29.489	-98.399
Duke University Durham, NC	www.duke.edu	152.3.72.104	35.995	-78.902
Massachusetts Institute of Technology Cambridge, MA	www.mit.edu	23.75.90.198	42.363	-71.084
University of Pennsylvania Philadelphia, PA	www.upenn.edu	50.58.123.35	39.297	-76.607
California Institute of Technology Pasadena, CA	www.cit.edu	205.251.133.94	33.726	-84.431
Dartmouth College Hanover, NH	www.dartmouth.edu	129.170.201.26	43.723	-72.134
Johns Hopkins University Baltimore, MD	www.jhu.edu	128.220.192.40	39.329	-76.597
Northwestern University Evanston, IL	www.northwestu.edu	70.97.96.63	47.673	-122.187
Brown University Providence, RI	www.brown.edu	128.148.252.129	41.827	-71.398
Washington University in St. LouisSt. Louis, MO	www.wustl.edu	128.252.87.149	38.666	-90.323
Cornell University Ithaca, NY	www.cornell.edu	132.236.204.10	42.448	-76.48
Vanderbilt University Nashville, TN	www.vanderbilt.edu	129.59.15.60	36.147	-86.777
Rice University Houston, TX	www.rice.edu	128.42.204.11	29.718	-95.419
University of Notre Dame Notre Dame, IN	nd.edu	204.236.227.245	39.044	-77.488
Emory University Atlanta, GA	www.emory.edu	170.140.125.16	33.795	-84.325
Georgetown University Washington, DC	www.georgetown.edu	205.134.189.192	39.05	-76.906
University of California—​Berkeley Berkeley, CA	www.berkeley.edu	169.229.216.200	37.867	-122.254
Carnegie Mellon University Pittsburgh, PA	www.cmu.edu	128.2.42.52	40.444	-79.956
University of California—​Los Angeles Los Angeles, CA	www.ucla.edu	164.67.228.152	33.787	-118.299
University of Southern California Los Angeles, CA	www.usc.edu	128.125.253.146	33.787	-118.299
University of Virginia Charlottesville, VA	www.virginia.edu	128.143.22.36	38.033	-78.514
Wake Forest University Winston-Salem, NC	www.wfu.edu	152.17.48.83	36.1	-80.244
Tufts University Medford, MA	www.tufts.edu	130.64.212.28	42.402	-71.119
University of Michigan—​Ann Arbor Ann Arbor, MI	www.umich.edu	141.211.243.44	42.324	-83.711
University of North Carolina—​Chapel Hill Chapel Hill, NC	unc.edu	152.19.230.139	36.052	-79.108
Boston College Chestnut Hill, MA	www.bc.edu	136.167.2.220	42.319	-71.15
Brandeis University Waltham, MA	www.brandeis.edu	129.64.99.200	42.376	-71.236
College of William and Mary Williamsburg, VA	www.wm.edu	128.239.29.10	37.271	-76.708
New York University New York, NY	www.nyu.edu	128.122.119.202	40.732	-73.988
University of Rochester Rochester, NY	www.rochester.edu	128.151.77.39	43.155	-77.616
Georgia Institute of Technology Atlanta, GA	www.gatech.edu	130.207.160.173	33.776	-84.398
Case Western Reserve University Cleveland, OH	www.case.edu	129.22.104.136	41.507	-81.605
Pennsylvania State University—​University Park University Park, PA	www.psu.edu	146.186.157.6	40.808	-77.861
University of California—​Davis Davis, CA	www.ucdavis.edu	128.120.33.39	38.483	-121.64
University of California—​San DiegoLa Jolla, CA	ucsd.edu	132.239.180.101	32.881	-117.236
Boston University Boston, MA	www.bu.edu	128.197.26.34	42.345	-71.099
Lehigh University Bethlehem, PA	www.lehigh.edu	128.180.2.57	40.59	-75.355
Rensselaer Polytechnic Institute Troy, NY	www.rpi.edu	128.113.2.68	42.75	-73.595
University of California—​Santa Barbara Santa Barbara, CA	www.ucsb.edu	128.111.24.41	34.433	-119.837
University of Illinois—​Urbana-​Champaign Champaign, IL	illinois.edu	128.174.180.122	40.11	-88.212
University of Wisconsin—​Madison Madison, WI	www.wisc.edu	144.92.9.185	43.076	-89.41
University of Miami Coral Gables, FL	www.miami.edu	129.171.32.100	25.72	-80.271
Yeshiva University New York, NY	www.yu.edu	129.98.180.8	40.845	-73.843
Northeastern University Boston, MA	www.northeastern.edu	155.33.17.68	42.342	-71.088
University of California—​Irvine Irvine, CA	uci.edu	128.195.188.232	33.64	-117.769
University of Florida Gainesville, FL	www.ufl.edu	128.227.9.48	29.652	-82.325
George Washington University Washington, DC	www.gwu.edu	128.164.1.16	38.938	-77.093
Ohio State University—​Columbus Columbus, OH	www.osu.edu	140.254.112.210	39.988	-83.044
Tulane University New Orleans, LA	tulane.edu	129.81.224.202	29.947	-90.123
University of Texas—​Austin Austin, TX	www.utexas.edu	128.83.40.144	30.296	-97.737
University of WashingtonSeattle, WA	www.washington.edu	128.95.155.135	47.661	-122.292
Fordham University New York, NY	www.fordham.edu	50.58.123.33	39.297	-76.607
Pepperdine University Malibu, CA	www.pepperdine.edu	137.159.8.186	34.04	-118.708
University of ConnecticutStorrs, CT	www.uconn.edu	137.99.25.178	41.808	-72.251
Southern Methodist University Dallas, TX	www.smu.edu	129.119.70.166	32.767	-96.778
University of Georgia Athens, GA	www.uga.edu	128.192.126.140	33.95	-83.375
Brigham Young University—​Provo Provo, UT	www.byu.edu	128.187.16.167	40.356	-111.732
Clemson University Clemson, SC	www.clemson.edu	130.127.69.75	34.534	-82.717
Syracuse University Syracuse, NY	www.syr.edu	128.230.171.184	43.038	-76.14
University of Maryland—​College Park College Park, MD	www.umd.edu	54.83.56.209	39.044	-77.488
University of Pittsburgh Pittsburgh, PA	www.pitt.edu	136.142.35.137	40.434	-80.025
Worcester Polytechnic Institute Worcester, MA	www.wpi.edu	130.215.36.26	42.286	-71.829
Purdue University—​West Lafayette West Lafayette, IN	www.purdue.edu	128.210.7.200	40.425	-86.916
Rutgers, the State University of New Jersey—​New Brunswick Piscataway, NJ	www.rutgers.edu	128.6.68.137	40.279	-74.368
Texas A&M University—​College Station College Station, TX	www.tamu.edu	165.91.22.70	30.652	-96.341
University of Minnesota—​Twin Cities Minneapolis, MN	www.umn.edu	134.84.119.7	44.976	-93.217
Virginia Tech Blacksburg, VA	www.vt.edu	198.82.183.54	37.179	-80.352
Michigan State University East Lansing, MI	www.msu.edu	35.9.15.49	42.728	-84.488
University of Iowa Iowa City, IA	www.uiowa.edu	128.255.67.14	41.664	-91.545
American University Washington, DC	www.american.edu	147.9.1.186	38.938	-77.093
Baylor University Waco, TX	www.baylor.edu	129.62.15.36	31.549	-97.147
Clark University Worcester, MA	www.clarku.edu	140.232.1.129	42.242	-71.81
Indiana University—​Bloomington Bloomington, IN	www.iub.edu	129.79.78.185	39.25	-86.456
Marquette University Milwaukee, WI	www.marquette.edu	134.48.29.23	43.039	-87.906
